id,album_title,eng_album_title,album_rd,album_seq,track_title,raw_track_title,eng_track_title,lyrics,hidden_track,remix,featured,performed_by,repackaged,lang,has_full_ver,is_alt_lang_ver,spotify_album_id,spotify_track_duration_ms,spotify_track_id,spotify_track_danceability,spotify_track_energy,spotify_track_key,spotify_track_loudness,spotify_track_mode,spotify_track_speechiness,spotify_track_acousticness,spotify_track_instrumentalness,spotify_track_liveness,spotify_track_valence,spotify_track_tempo,spotify_track_time_signature,eng_lyrics_source_url,eng_lyrics_credits
SUGA-23,D-DAY,D-DAY,2023-04-21,2,해금 (Haegeum),해금,Haegeum,"Yeah
Okay, okay
Yeah, yeah, yeah

This song's a haegeum, yeah
Get on board now, yeah
This lively rhythm
Perhaps, this could be a new kind of haegeum
This song’s a haegeum, yeah
Get on board now, yeah
This lively rhythm
Perhaps, this could be a new kind of haegeum

This song's a haegeum, yeah
Get on board now, yeah
This lively rhythm
Perhaps, this could be a new kind of haegeum, yeah
Interpretation is free for all
Out with the nonsense
Freedom of expression
Could be reason for somebody's death
Could you still consider that freedom?
If your convictions are reflected in your judgment and speculations
And you believe that your freedom is on the same level as others
Then don’t hesitate, just get on board
Liberation from all that's forbidden
For all those living in these unfortunate times
Who don't even understand their own tastes

This song's simply about freeing what's forbidden
But you must remember to differentiate freedom from self-indulgence
This song's a haegeum
Get on board now
This lively rhythm
A new kind of haegeum

This song's a haegeum, yeah
Get on board now, yeah
This lively rhythm
Perhaps, this could be a new kind of haegeum
This song's a haegeum, yeah
Get on board now, yeah
This lively rhythm
Perhaps, this could be a new kind of haegeum

Endless influx of information prohibits freedom of imagination, and seeks conformity of thought
All these painful noises blind you, and
Now it even infringes on freedom of thought
All the controversy incessantly
Triggers confusion in judgment uh
Really, what is it exactly that’s been restricting us?
Maybe we do it to ourselves
Slaves to capitalism, slaves to money
Slaves to hatred and prejudice
Slaves to YouTube, slaves to flexin’
Selfishness and greed have gone off the rails
I close my eyes and it's easy, it’s all so obvious
Opinions clearly split depending on what's to gain
Everyone's been blinded by envy and jealousy
Without realizing that they're putting shackles on each other

Don’t get swept away by this tsunami of info
'Cause we all differentiate freedom from self-indulgence
This song's a haegeum
Get on board now
This lively rhythm
A new kind of haegeum

This song's a haegeum, yeah
Get on board now, yeah
This lively rhythm
Perhaps, this could be a new kind of haegeum
This song's a haegeum, yeah
Get on board now, yeah
This lively rhythm
Perhaps, this could be a new kind of haegeum
This song's a haegeum, yeah
Get on board now, yeah
This lively rhythm
Perhaps, this could be a new kind of haegeum
This song's a haegeum, yeah
Get on board now, yeah
This lively rhythm
Perhaps, this could be a new kind of haegeum",FALSE,FALSE,,SUGA,FALSE,KOR,FALSE,FALSE,446ROKmKfpEwkbi2SjELVX,168926,4bjN59DRXFRxBE1g5ne6B1,0.697,0.837,7,-2.651,1,0.304,0.313,0,0.471,0.831,85.097,5,,
SUGA-24,D-DAY,D-DAY,2023-04-21,3,HUH?! (feat. j-hope),,HUH?! (feat. j-hope),"Wait
Wait
What the shit, do you know about me? (Yeah, yeah)
What the shit, do you know about me? (Yeah, yeah)

Woo
What the shit, do you know about me? (About me, yeah, yeah)
What the shit, do you know about me? (About me, yeah, yeah)
What the shit, do you know about me? (About me, yeah, yeah)
Fuck that shit, you think you know ‘bout me (all me)
Every shit is your wannabe life (Wait, woo)
Your wannabe life (Wait, woo, woo)
Your wannabe life, ‘bout me, all me
This is your wannabe life, ‘bout me, all me
This is your wannabe life

That airborne, airborne
It doеsn't apply to me, it's for nothing
It’s so tacky, you guys who only made music
I'm busy taking medicinе
The karma of success accumulated from Daegu
How lucky is success
Do fly to the White House, guys
I don't know what's important, my inferiority complex explodes
Worried about me every time that I messed up
Why don't you know your life is ruined
Yes, the Internet world and reality are quite different
Live your life
Everyone is trying to get hold around to wake up
All ears, a hundred times
It's disgusting to pretend that you're clean
Please check your shit first
Many articles and gossip, the villain in the information age
If reality is a gutter, get out of it
I pray that even you'll do well

What the shit, do you know about me? (About me, yeah, yeah)
What the shit, do you know about me? (About me, yeah, yeah)
What the shit, do you know about me? (About me, yeah, yeah)
Fuck that shit, you think you know ‘bout me (All me)
Every shit is your wannabe life (Wait, woo)
Your wannabe life (Wait, woo, woo)
Your wannabe life, ‘bout me, all me
This is your wannabe life, ‘bout me, all me
This is your wannabe life

Whatever you think, huh
No matter what you do
No matter what you say, huh
Whatever you have, huh
No matter what you know
No matter what you may be, huh
I'm all about you, huh
Because it's just worthless, huh
What do you need to say, huh, huh
Even if I do my job, even if I go my own way
'Cause it's a hot topic, bring the fire back
My plan goes straight (Burn up)
On the street, keep that (Burn up)
My step is deep (Burn up)
So my comeback is easy (Burn up)
Now the system will be an insult, huh
Overheated machines, huh
'Cause I can't stand adversity, I can't stand contempt
This is my feedback, huh

What the shit, do you know about me? (About me, yeah, yeah)
What the shit, do you know about me? (About me, yeah, yeah)
What the shit, do you know about me? (About me, yeah, yeah)
Fuck that shit, you think you know ‘bout me (all me)
Every shit is your wannabe life (Wait, woo)
Your wannabe life (Wait, woo, wa-ya-ya-ya)
Your wannabe life, ‘bout me, all me
This is your wannabe life, ‘bout me, all me
This is your wannabe life",FALSE,FALSE,,SUGA: J-HOPE,FALSE,KOR,FALSE,FALSE,446ROKmKfpEwkbi2SjELVX,183290,6XrPzwKeGzEvtan3acn7VH,0.763,0.806,9,-2.785,1,0.302,0.207,0,0.229,0.522,139.911,4,,
SUGA-25,D-DAY,D-DAY,2023-04-21,4,AMYGDALA,,AMYGDALA,"Woah-oh-oh, yeah
Woah-oh-oh, yeah
I don't know your name
I don't know your name, yeah
I don't know your name
How you feelin' lately?
I don't know your name, your name, your name
Travelling to memories
Things I wanna erase
How you feelin' lately?

1993
The month I was born
My mother's heart surgery
A whole lot was happened back then
Don't know why things are so hectic
I'ma bring back my memories, I can't even remember
Let's unpack them, one by one
Let's unpack them, one by one

Oh-oh, oh
The bеst choice
Then the sеcond-best choice
Third-best choice, choice, yeah
Things I never ask for
Things that are outta my control
Let's put them back in, one after another
Yes, one, two, yes, one, two

I don't know your name, your name, your name
Travelling to memories
I don't know your name, your name, your name
Come on, let's erase them one by one, yes, one by one

My amygdala (My amygdala)
Please save me, please save me
My amygdala (My amygdala)
Please let me out, please let me out
My amygdala (My amygdala)
My amygdala (My amygdala)
Save me from here, hurry and get me out of here, yeah, yeah

Uh-uh, yeah, a whole lot was happening back then
Uh-uh, the sound of mom's heart tickin' away in my ears
Uh-uh, my accident that I couldn't even mention
The call I got during my work about father's liver cancer
(Woah-oh) Hoped made the best decisions
(Woah-oh) Because they're also all in the past now
So, is all countless suffering for my own good?
What didn't kill me only made me stronger
And I begin to bloom like a lotus flower once again

Oh-oh, oh
The best choice
Then the second-best choice
Third-best choice, choice, yeah
Things I never ask for
Things that are outta my control
Let's put them back in, one after another
Yes, one, two, yes, one, two

I don't know your name, your name, your name
Travelling to memories
I don't know your name, your name, your name
Come on, let's erase them one by one, yes, one by one

My amygdala (My amygdala)
Please save me, please save me
My amygdala (My amygdala)
Please let me out, please let me out
My amygdala (My amygdala)
My amygdala (My amygdala)
Save me from here, hurry and get me out of here, yeah, yeah",FALSE,FALSE,,SUGA,FALSE,KOR,FALSE,FALSE,446ROKmKfpEwkbi2SjELVX,251533,5fj32MKLHkut2Vod1UodcU,0.311,0.769,7,-4.637,1,0.0553,0.226,0,0.105,0.16,78.265,4,,
SUGA-26,D-DAY,D-DAY,2023-04-21,5,SDL,,SDL,"Yeah, somebody does love
But I'm thinking 'bout you
Somebody does love oh, oh, oh
Somebody does love
But I'm thinking 'bout you, you, oh
I'm thinking 'bout you

Who do you love?
Who else do you think?
Who else do you remember?
Who else do you hate?
Who do you live for?
Who else are you smiling for?
Who do you cry for?
Could this be love?
Thanks to the grandeur of the word love
What is easily forgotten and lived is called love
Is it you that you miss
Or is it that time on the other side of the glorified mеmory?

Yeah, somebody does lovе
But I'm thinking 'bout you
Somebody does love, oh, oh, oh
Somebody does love
But I'm thinking 'bout you, you, oh
I'm thinking 'bout you

I mean, nothing works out as you wish
Relationships are really difficult
It wasn't right from the start
The gap between the two of us
Trying to narrow it down is unreasonable
Memories are bound to be glorified (Oh, woah, woah, yeah)
As if it's already faded
We use to sing forever like a dream
Is it you that I miss
Or is it the time when regrets and regrets remain?

Yeah, somebody does love
But I'm thinking 'bout you (I'm thinking 'bout you)
Somebody does love, oh, oh, oh (Oh, woah)
Somebody does love
But I'm thinking 'bout you, you, oh
I'm thinking 'bout you

Love is pouring out in the spring day
Even though it's like sunlight
The strong waves of the winter sea that came in before we knew it
Is it then that we miss
Or is it buried in your memories?
So I'm just trying to laugh silently
Because it's hard to recall the glorified times
Is it that time we're reminiscing
Or are you smiling in the memories?

Yeah, somebody does love
But, I'm thinking 'bout you (Yeah, yeah)
Somebody does love, oh, oh, oh
Somebody does love
But I'm thinking 'bout you, you, oh (I'm thinking 'bout you)
I'm thinking 'bout you",FALSE,FALSE,,SUGA,FALSE,KOR,FALSE,FALSE,446ROKmKfpEwkbi2SjELVX,171442,2vRoAkwc3UBEPW2udvN0u9,0.575,0.854,9,-2.62,1,0.214,0.2,0,0.226,0.609,164.029,4,,
SUGA-27,D-DAY,D-DAY,2023-04-21,6,사람 Pt.2 (People Pt.2) (feat. IU),사람 Pt.2 (feat. IU),People Pt.2 (feat. IU),"So time is yet now, right here to go
I know, you know, anything does know
So time is yet now, right here to go
Nobody doesn’t know anymore

This thing called love
Maybe it's just a momentary list of emotions
It's conditional, what is it that I love?
Wasn't loved enough as a kid
That's why I'm the cautious type
I want, a sincere connection with others
Forever's something like a sand castle, you know
It comes crumbling down at the calmest of waves
What is it about loss that makes us so sad?
Really, it's the dread that makes us so sad

So far away, you're gone
Getting far away
Too far away, you'rе gone
I know, I have to know, yeah

So timе is yet now, right here to go
I know, you know, anything does know
So time is yet now, right here to go
Nobody doesn't know anymore

What is it that makes you so sad?
Really, it's the dread that’s so daunting
The us that dreamt of a future together is no more
We're the ones who tore down the sand castle
They say there are no winners or losers in this game
But I'm always the loser
We said we'd give our all, but we tore it all down
And then we leave
Because both love and people are selfish

So far away, you're gone
Getting far away
Too far away, you're gone
I know, I have to know, yeah

So time is yet now, right here to go (Go)
I know, you know, anything does know (Hmm)
So time is yet now, right here to go (Right here to go)
Nobody doesn't know anymore, yeah

So goes the person (Person), and so goes the love (Love)
What comes at the end of love? (The end of love)
Endless people (People) , a love that has passed by (Love)
Is love wholly perfect on its own? (Perfect on its own?)
Selflessness can actually be selfish, too, it's true
It's actually my greed when I say that it’s all for you
Will I be happy if I give up my greed
A half-illusion that can never be fulfilled

They say life's a struggle between resistance and submission
I say it's a struggle against loneliness
If you can't hold it back, it's okay to cry
You're already more than enough to be loved
So time is yet now

So time is yet now, right here to go
I know, you know, anything does know
So time is yet now, right here to go
Nobody doesn't know anymore, yeah",FALSE,FALSE,IU,SUGA,TRUE,KOR,FALSE,FALSE,446ROKmKfpEwkbi2SjELVX,213995,41JPN7pZMTp1sumBOHOzHd,0.729,0.574,7,-4.779,0,0.0589,0.391,0,0.319,0.438,88.94,4,,
SUGA-28,D-DAY,D-DAY,2023-04-21,7,극야 (Polar Night),극야,Polar Night,"Between so many truths and so many lies
Are we seeing this world right?

The difference between truth and lies
Between incitement and nature
What are my benefits?
I can't live like a dog in a dog world
Keep your eyes open
The opposite of justice is another definition
You know, there's no such thing as good faith
I'm not interested in facts, if you're not on my side
Killing him is the definition now
After a series of plays, left and right, black and white
The audiеnce sees blood as they bite еach other
A war without guns
An omnipotent ills
If you're not on my side, you're all my enemies
An extreme choice to become

Political correctness is also my cup of tea
Keep your mouth shut about troublesome problems
Selective hypocrisy and uncomfortable attitude
That interpretation that only suits my mood
Truth and lies are up to your taste
My eyes are locked in the camp
Selective hypocrisy and uncomfortable attitude
That interpretation that only suits my mood

Between so many truths and so many lies
Are we seeing this world right?
It is all dirty (Am I also clean?)
It is all dirty (Are you clean?)
Between dark questions and indiscriminate accusations
What do we fight for
It is all dirty (Am I also clean?)
It is all dirty (Are you clean?)

While calling out for justice with a bloody tongue
Those who hold their breath, don't laugh at me
If you keep your mouth shut too many times
He pointed his fingers at me
How dare you look at me?
It's hidden in anonymity
The murder of the cowardly people
""All the harsh words are for you
Now, you're trying to explain, how dare you?""
Look, the one who keeps his mouth shut
The cheap justice you've been calling for
It's not for those who bleed
Please face this uncomfortable line
Noise made by the yellow press
Makes a choice by someone's advantage
What the point of us fighting and hitting each other
Look at the end of the spear

Political correctness is also my cup of tea
Keep your mouth shut about troublesome problems
Selective hypocrisy and uncomfortable attitude
That interpretation that only suits my mood
Truth and lies are up to your taste
I close my eyes to the uncomfortable truth
Selective hypocrisy and uncomfortable attitude
That interpretation that only suits my mood

Between so many truths and so many lies
Are we seeing this world right?
It is all dirty (Am I also clean?)
It is all dirty (Are you clean?)
Between dark questions and indiscriminate accusations
What do we fight for
It is all dirty (Am I also clean?)
It is all dirty (Are you clean?)",FALSE,FALSE,,SUGA,FALSE,KOR,FALSE,FALSE,446ROKmKfpEwkbi2SjELVX,165319,3JSodIIStqTwXSH7nXOuhe,0.68,0.877,6,-4.224,0,0.223,0.137,0,0.34,0.906,128.045,4,,
SUGA-29,D-DAY,D-DAY,2023-04-21,8,Interlude : Dawn,,Interlude : Dawn,,FALSE,FALSE,,SUGA,FALSE,NA,FALSE,FALSE,446ROKmKfpEwkbi2SjELVX,105139,56tf3cHQkwmvoplotk5QXd,0.188,0.309,5,-10.564,0,0.0287,0.898,0.771,0.0621,0.0677,90.687,4,,
SUGA-30,D-DAY,D-DAY,2023-04-21,9,"Snooze (feat. Ryuichi Sakamoto, WOOSUNG of The Rose)",,"Snooze (feat. Ryuichi Sakamoto, WOOSUNG of The Rose)","You, who's dreaming while looking at me
I'm always here behind you, so don't worry too much
If you're afraid to crash, I'll willingly receive you
So you don't suffer like I did
You, who sacrifice your sleep for your dreams, it's okay to rest
For today, don't even dream
When you silently give me a light smile
Only then, I feel a little relieved

It may be very difficult, this road I've walked on
It may have looked like a flower path
But, know that it was a thorny path with enemies everywherе
I hope you never forgеt the one who throw flowers on the road for you
When you're laughing, don't forget the one who cries
'Cause they live a day on your smile
When you get erased in the repeating schedule
It's okay to feel overewhelmed, if it's too much for you, you can take a little rest
Cry out loud when the world gets ugly
When the hand that greeted you turned into a pointing finger
You can take a deep sigh and shout ""This shit is fucked up""
Because you are no different from anyone else
Why did you choose this painful and lonely road
Never forget the reason, even if time passes
I hope your dream won't just be left as a dream
I'll cheer you on anytime, anywhere (Dream)

When the petals wither and fall
I'll cover you good night
When the fog goes away
I'm leaving, bye
Blooming dream

You, who's dreaming while looking at me
I'm always here behind you, so don't worry too much
If you're afraid to crash, I'll willingly receive you
So you don't suffer like I did
You, who sacrifice your sleep for your dreams, it's okay to rest
For today, don't even dream
When you silently give me a light smile
Only then, I feel a little relieved

This is a battlefield without gunshots
Your colleagues are also your enemies
The cruel and beautiful good and evil that numbers determines
If I can't kill others, I must die
This scene isn't a ring, so why kill someone?
When you hate something you simply used to like
When wishes are blown away by the wind
It's okay, everything becomes memories and lessons when you look past it
Don't forget, the world isn't very patient
Don't ever laugh at other people's controversies
Because that might happen to you someday
Your success will be your leash and shackles
The feeling of walking on a tightrope will suffocate you
Just laugh out loud, as if the world is leaving
Just hold on
Wherever you are
I hope your dream won't just be left as a dream
I'll cheer you on anytime, anywhere (Dream)

When the petals wither and fall
I'll cover you good night
When the fog goes away
I'm leaving, bye
Blooming dream

Everything will be okay, everything will be okay
Everything will be okay, everything will be okay
Everything will be okay, everything will be okay
Everything will be okay, everything will be okay
Everything will be okay, everything will be okay
Everything will be okay, everything will be okay
Everything will be okay, everything will be okay
Everything will be okay, everything will be okay

Dream, I will be there for you in your creation 'til the end of your life
Dream, Be generous, wherever you might be
Dream, You will fully bloom, after all the hardships
Dream, The beginning may be humble, but the future will be prosperous
Dream

When the last petal falls
I'll accept it, hold tight
When you reach the end of the rainbow
I'll leave bye
Blooming dream

You, who's dreaming while looking at me
I'm always here behind you, so don't worry too much
If you're afraid to crash, I'll willingly receive you
So you don't suffer like I did
You, who sacrifice your sleep for your dreams, it's okay to rest
For today, don't even dream
When you silently give me a light smile
Only then, I feel a little relieved

Dream",FALSE,FALSE,Ryuichi Sakamoto; WOOSUNG of The Rose,SUGA,FALSE,KOR,FALSE,FALSE,446ROKmKfpEwkbi2SjELVX,264760,4j3M8NrbGSXdMPwEVsnfHE,0.761,0.777,5,-4.68,0,0.0941,0.21,0,0.0771,0.377,89.959,4,,
SUGA-31,D-DAY,D-DAY,2023-04-21,10,Life Goes On,,Life Goes On,"For some reason
We've moved away
But we, we, we
Don't blame anyone
It's nothing between us
I said I couldn't take it off
I keep getting scared
I'm afraid we'll go far away forever

I will borrow this music and give it to you
People say the world has changed
Fortunately, our relationship hasn't changed yet
Let's say goodbye, not bye, hello
Even if the world doesn't go my way
Let's count just a few nights as we wish
I'll never forget the day we meet again

As time goеs by
Someone will be forgottеn
Just do what you want
Time is like a wave
It will be washed away like the ebb
But don't forget to find me

This moment when everyone stopped
The porch that looks far away today
Life goes on, life goes on
Life goes on, life goes on
This moment when everyone fallen apart
Our relationship is getting farther than yesterday
Life goes on, life goes on
Life goes on, life goes on

The place where I passed for ten years
With countless wounds and glory
Looking back, each moment of memories
I've been running like it was the last time but I'm still scared
I know, I know this place right now
A place that will soon become a memory
Don't be afraid until the end of my life
Because life will go on forever

As time goes by
Someone will be forgotten
Just do what you want
Time is like a wave
It will be washed away like the ebb
But don't forget to find me

This moment when everyone stopped
The porch that looks far away today
Life goes on, life goes on
Life goes on, life goes on
This moment when everyone fallen apart
Our relationship is getting farther than yesterday
Life goes on, life goes on
Life goes on, life goes on",FALSE,FALSE,,SUGA,FALSE,KOR,FALSE,FALSE,446ROKmKfpEwkbi2SjELVX,197638,7gv3UYPh05ZDP7Io5BIsn7,0.439,0.733,4,-6.471,1,0.0773,0.0345,0,0.292,0.615,162.125,4,,
